{
    "$schema": "https://json-schema.org/draft/2020-12/schema",
    "$id": "https://raw.githubusercontent.com/imperialCHEPI/healthgps/main/schemas/config/models/staticlinear.json",
    "type": "object",
    "properties": {
        "$schema": {
            "type": "string"
        },
        "ModelName": {
            "const": "StaticLinear"
        },
        "InformationSpeed": {
            "type": "number"
        },
        "PhysicalActivityStdDev": {
            "type": "number"
        },
        "RuralPrevalence": {
            "type": "array",
            "items": {
                "type": "object",
                "properties": {
                    "Name": {
                        "type": "string"
                    },
                    "Female": {
                        "type": "number"
                    },
                    "Male": {
                        "type": "number"
                    }
                },
                "additionalProperties": false
            }
        },
        "IncomeModels": {
            "type": "object",
            "additionalProperties": {
                "type": "object",
                "properties": {
                    "Intercept": {
                        "type": "number"
                    },
                    "Coefficients": {
                        "type": "object",
                        "additionalProperties": {
                            "type": "number"
                        }
                    }
                },
                "required": [
                    "Intercept",
                    "Coefficients"
                ],
                "additionalProperties": false
            }
        },
        "Region": {
            "type": "object",
            "additionalProperties": {
                "type": "object",
                "properties": {
                    "name": {
                        "type": "string"
                    },
                    "value": {
                        "type": "integer"
                    }
                },
                "required": [
                    "name",
                    "value"
                ],
                "additionalProperties": false
            }
        },
        "Ethnicity": {
            "type": "object",
            "additionalProperties": {
                "type": "object",
                "properties": {
                    "name": {
                        "type": "string"
                    },
                    "value": {
                        "type": "integer"
                    }
                },
                "required": [
                    "name",
                    "value"
                ],
                "additionalProperties": false
            }
        },
        "PhysicalActivityModels": {
            "type": "object",
            "propertyNames": {
                "enum": [
                    "simple",
                    "continuous"
                ]
            },
            "additionalProperties": {
                "oneOf": [
                    {
                        "type": "object",
                        "description": "Simple physical activity model (India approach) - uses standard deviation only",
                        "properties": {
                            "PhysicalActivityStdDev": {
                                "type": "number",
                                "description": "Standard deviation for physical activity calculation"
                            }
                        },
                        "required": [
                            "PhysicalActivityStdDev"
                        ],
                        "additionalProperties": false
                    },
                    {
                        "type": "object",
                        "description": "Continuous physical activity model (FINCH approach) - uses CSV file with coefficients",
                        "properties": {
                            "csv_file": {
                                "type": "string",
                                "description": "CSV file containing physical activity model coefficients"
                            },
                            "format": {
                                "type": "string",
                                "enum": [
                                    "csv"
                                ],
                                "default": "csv"
                            },
                            "delimiter": {
                                "type": "string",
                                "default": ","
                            },
                            "encoding": {
                                "type": "string",
                                "default": "ASCII"
                            },
                            "columns": {
                                "type": "object",
                                "description": "Column definitions for the physical activity model CSV",
                                "properties": {
                                    "Factor": {
                                        "type": "string",
                                        "description": "Factor name column (e.g., Intercept, age, gender, region names, ethnicity names, etc.)"
                                    },
                                    "Coefficient": {
                                        "type": "string",
                                        "description": "Coefficient value column"
                                    }
                                },
                                "required": [
                                    "Factor",
                                    "Coefficient"
                                ],
                                "additionalProperties": false
                            }
                        },
                        "required": [
                            "csv_file"
                        ],
                        "additionalProperties": false
                    }
                ]
            }
        },
        "RiskFactorModels": {
            "type": "object",
            "additionalProperties": {
                "type": "object",
                "properties": {
                    "Lambda": {
                        "type": "number"
                    },
                    "StdDev": {
                        "type": "number"
                    },
                    "Intercept": {
                        "type": "number"
                    },
                    "Range": {
                        "type": "array",
                        "items": {
                            "type": "number"
                        },
                        "minItems": 2,
                        "maxItems": 2
                    },
                    "Coefficients": {
                        "additionalProperties": {
                            "type": "number"
                        }
                    },
                    "Policy": {
                        "type": "object",
                        "properties": {
                            "Intercept": {
                                "type": "number"
                            },
                            "Range": {
                                "type": "array",
                                "items": {
                                    "type": "number"
                                },
                                "minItems": 2,
                                "maxItems": 2
                            },
                            "Coefficients": {
                                "additionalProperties": {
                                    "type": "number"
                                }
                            },
                            "LogCoefficients": {
                                "additionalProperties": {
                                    "type": "number"
                                }
                            }
                        },
                        "additionalProperties": true
                    },
                    "Trend": {
                        "type": "object",
                        "properties": {
                            "Intercept": {
                                "type": "number"
                            },
                            "Coefficients": {
                                "type": "object",
                                "additionalProperties": {
                                    "type": "number"
                                },
                                "minItems": 1
                            },
                            "LogCoefficients": {
                                "type": "object",
                                "additionalProperties": {
                                    "type": "number"
                                },
                                "minItems": 1
                            },
                            "Range": {
                                "type": "array",
                                "items": {
                                    "type": "number"
                                },
                                "minItems": 2,
                                "maxItems": 2
                            },
                            "Lambda": {
                                "type": "number"
                            }
                        },
                        "additionalProperties": true
                    },
                    "ExpectedTrend": {
                        "type": "number"
                    },
                    "ExpectedTrendBoxCox": {
                        "type": "number"
                    },
                    "TrendSteps": {
                        "type": "integer"
                    }
                },
                "additionalProperties": true
            }
        },
        "RiskFactorCorrelationFile": {
            "$ref": "../csv_file.json"
        },
        "PolicyCovarianceFile": {
            "$ref": "../csv_file.json"
        }
    },
    "additionalProperties": true
}
